{"capabilities":[{"adapter":"synthetic-adapter-v1","name":"accounts","reasonCodes":[],"result":"supported"},{"adapter":"synthetic-adapter-v1","name":"contacts","reasonCodes":[],"result":"supported"},{"adapter":"synthetic-adapter-v1","name":"chats","reasonCodes":[],"result":"supported"},{"adapter":"synthetic-adapter-v1","name":"chat_lists","reasonCodes":[],"result":"supported"},{"adapter":"synthetic-adapter-v1","name":"participants","reasonCodes":[],"result":"supported"},{"adapter":"synthetic-adapter-v1","name":"messages","reasonCodes":[],"result":"supported"},{"adapter":"synthetic-adapter-v1","name":"message_events","reasonCodes":[],"result":"supported"},{"adapter":"synthetic-adapter-v1","name":"reactions","reasonCodes":[],"result":"supported"},{"adapter":"synthetic-adapter-v1","name":"receipts","reasonCodes":[],"result":"supported"},{"adapter":"synthetic-adapter-v1","name":"poll_votes","reasonCodes":[],"result":"supported"},{"adapter":"synthetic-adapter-v1","name":"group_events","reasonCodes":[],"result":"supported"},{"adapter":"synthetic-adapter-v1","name":"statuses","reasonCodes":[],"result":"supported"},{"adapter":"synthetic-adapter-v1","name":"calls","reasonCodes":[],"result":"supported"},{"adapter":"synthetic-adapter-v1","name":"channels","reasonCodes":[],"result":"supported"},{"adapter":"synthetic-adapter-v1","name":"channel_events","reasonCodes":[],"result":"supported"},{"adapter":"synthetic-adapter-v1","name":"communities","reasonCodes":[],"result":"supported"},{"adapter":"synthetic-adapter-v1","name":"community_relations","reasonCodes":[],"result":"supported"},{"adapter":"synthetic-adapter-v1","name":"presence_snapshots","reasonCodes":[],"result":"supported"},{"adapter":"synthetic-adapter-v1","name":"media","reasonCodes":[],"result":"supported"}],"probedAtUtc":"2026-01-15T08:00:01.000Z","schemaVersion":"1.0.0","sourceId":"22222222-2222-4222-8222-222222222222","whatsappBuild":"synthetic-build.invalid"}
